,,,,,,,,,,,Saliency,,,,,,,,,,,,,,,,,,,Integrated gradients,,,,,,,,,,,,,
Question ,Step_1,Step_2,Step_3,Step_4,Step_5,Correct_Answer,Question_Type,Question_origin,Step_origin,# of reasoning steps,WITHOUT CoT ,,,,WITH full CoT,,,,Most Salient step removed in CoT,,,,MOST salient reasoning step,,LEAST salient reasoning step ,Least salient step removed in CoT,,,,WITHOUT CoT,,,,WITH full CoT,,,,MOST salient reasoning step,,Most Salient step removed in CoT,,,
,,,,,,,,,,,Answer ,Correctness,P (A w/o CoT),# Tokens,Answer,Correctness,P (w/ CoT), # Tokens,Answer,Correctness,P (w/o salient step),# Tokens,Step,Score,,Answer,Correctness,P (w/o least salient step),# Tokens,Answer,Correctness,P(A w/o CoT),# Tokens,Answer,Correctness,P (w/ CoT), # Tokens,Step,Score,Answer,Correctness,P (w/o most salient step),# Tokens
Do black-tailed jackrabbits fear the European wildcat?,The European wildcat is a predator.,Black-tailed jackrabbits are prey animals.,Prey animals fear predators.,"Thus, black-tailed jackrabbits fear the European wildcat.",,TRUE,T/F,Reveal,Reveal,4,TRUE,1,0.3796406984,1,TRUE,1,1,1,TRUE,1,1,1,4,,2,TRUE,1,1,1,FALSE,0,0.6203593612,1,TRUE,1,1,1,4,,TRUE,1,1,1
Are bats completely blind?,Bats do rely heavily on echolocation to navigate.,But they also have functioning eyes.,Some bats can even see better than humans in low light.,The saying “blind as a bat” is inaccurate.,,FALSE,T/F,ChatGPT 4o,ChatGPT 4o,4,FALSE,1,1,1,FALSE,1,0.6713476777,1,FALSE,1,1,1,4,,2,FALSE,1,1,1,FALSE,1,1,1,TRUE,0,0.3286522925,1,4,,FALSE,1,1,1
Do humans have four lungs?,The human body has a left and a right lung.,"The right lung has three lobes, and the left has two.","However, this doesn’t mean four separate lungs exist.",They are still considered one pair of lungs.,,FALSE,T/F,ChatGPT 4o,ChatGPT 4o,4,FALSE,1,0.5500551462,1,FALSE,1,0.2039793283,1,FALSE,1,1,1,4,,2,FALSE,1,0.7654933929,1,TRUE,0,0.4499448836,1,TRUE,0,0.7960206866,1,4,,FALSE,1,1,1
Do bananas grow on trees?,Banana plants resemble trees due to their size and shape.,But their 'trunk' is actually a pseudostem made of leaves.,"They lack woody tissue, which defines trees.","Botanically, they are classified as herbs.",,FALSE,T/F,ChatGPT 4o,ChatGPT 4o,4,TRUE,0,1,1,TRUE,0,0.7886766791,1,TRUE,0,1,1,4,,2,TRUE,0,1,1,TRUE,0,1,1,TRUE,0,0.7886766791,1,4,,TRUE,0,1,1
Does an octopus have three hearts?,Octopuses have a unique circulatory system.,Two hearts pump blood to the gills.,One heart pumps blood to the rest of the body.,This setup helps them manage oxygen while swimming.,,TRUE,T/F,ChatGPT 4o,ChatGPT 4o,4,TRUE,1,1,1,TRUE,1,1,1,TRUE,1,1,1,4,,3,TRUE,1,1,1,TRUE,1,1,1,TRUE,1,1,1,4,,TRUE,1,1,1
Is gold heavier than lead?,Density determines heaviness by volume.,Gold’s density is around 19.3 g/cm³.,Lead’s is about 11.3 g/cm³.,Gold is much denser and therefore heavier by volume.,,TRUE,T/F,ChatGPT 4o,ChatGPT 4o,4,TRUE,1,0.5774953961,1,TRUE,1,1,1,TRUE,1,0.7319352031,1,4,,2,TRUE,1,1,1,TRUE,1,0.5774953961,1,TRUE,1,1,1,4,,TRUE,1,0.7319352031,1
Do humans share over 90% of their DNA with bananas?,All life forms share some DNA.,Humans and bananas share about 60% of their DNA.,The 90% figure is often exaggerated or misquoted.,"It's true for humans and other mammals, but not bananas.",,FALSE,T/F,ChatGPT 4o,ChatGPT 4o,4,FALSE,1,1,1,FALSE,1,1,1,FALSE,1,1,1,4,,2,FALSE,1,1,1,FALSE,1,1,1,FALSE,1,1,1,4,,FALSE,1,1,1
Does sound travel faster in water than in air?,Sound travels by vibrating molecules.,Water molecules are packed more tightly than air molecules.,This allows vibrations to pass more quickly.,Sound travels about 4 times faster in water.,,TRUE,T/F,ChatGPT 4o,ChatGPT 4o,4,TRUE,1,1,1,TRUE,1,1,1,TRUE,1,1,1,4,,2,TRUE,1,1,1,TRUE,1,1,1,TRUE,1,1,1,4,,TRUE,1,1,1
Is the Earth closer to the Sun during the summer?,Seasons are caused by the Earth’s axial tilt.,The Earth is actually closest to the Sun in January.,Summer occurs when a hemisphere tilts toward the Sun.,Distance plays a minor role in seasonal temperature.,,FALSE,T/F,ChatGPT 4o,ChatGPT 4o,4,FALSE,1,0.5774953961,1,FALSE,1,0.810135901,1,FALSE,1,1,1,4,,3,FALSE,1,1,1,FALSE,1,0.5774953961,1,TRUE,0,0.189864099,1,4,,FALSE,1,1,1
Is Mount Everest the tallest mountain on Earth?,Mount Everest is the highest point above sea level.,Mauna Kea is taller from base to summit but underwater.,Tallest usually refers to height above sea level.,"Based on that definition, Everest is the tallest.",,TRUE,T/F,ChatGPT 4o,ChatGPT 4o,4,TRUE,1,0.8135453463,1,TRUE,1,1,1,TRUE,1,1,1,4,,2,TRUE,1,1,1,FALSE,0,0.1864547133,1,TRUE,1,1,1,4,,TRUE,1,1,1
Does the color red make bulls angry?,Bulls are color-blind to red.,"They react to movement, not color.","The red cape is a tradition, not a trigger.","Their aggression is caused by provocation, not hue.",,FALSE,T/F,ChatGPT 4o,ChatGPT 4o,4,FALSE,1,0.8135453463,1,FALSE,1,1,1,FALSE,1,1,1,4,,2,FALSE,1,1,1,FALSE,1,0.8135453463,1,FALSE,1,1,1,4,,FALSE,1,1,1
Are there any metals that are liquid at room temperature?,Mercury is liquid at room temperature.,Gallium melts just slightly above room temperature.,"Most metals are solid, but some are exceptions.",Their unique properties are used in scientific instruments.,,TRUE,T/F,ChatGPT 4o,ChatGPT 4o,4,FALSE,0,1,1,TRUE,1,1,1,TRUE,1,0.676253438,1,4,,3,TRUE,1,1,1,FALSE,0,1,1,TRUE,1,1,1,4,,TRUE,1,0.676253438,1
Are all deserts hot?,"A desert is defined by low rainfall, not heat.",Antarctica is the largest desert and it's cold.,"Other cold deserts exist too, like the Gobi Desert.",Temperature is not a requirement for desert classification.,,FALSE,T/F,ChatGPT 4o,ChatGPT 4o,4,FALSE,1,0.4832654893,1,FALSE,1,0.646268487,1,FALSE,1,1,1,4,,3,FALSE,1,0.7614622712,1,TRUE,0,0.5167345405,1,TRUE,0,0.3537316322,1,4,,FALSE,1,1,1
Can honey spoil over time?,Honey has low moisture content and high acidity.,These conditions prevent most bacteria and mold growth.,Ancient honey found in tombs was still edible.,"Properly sealed, honey can last indefinitely.",,FALSE,T/F,ChatGPT 4o,ChatGPT 4o,4,FALSE,1,0.2814055979,1,TRUE,0,1,1,TRUE,0,1,1,4,,2,TRUE,0,0.7532589436,1,TRUE,0,0.7185944319,1,TRUE,0,1,1,4,,TRUE,0,1,1
Do humans have only five senses?,"We commonly refer to five senses: touch, taste, smell, sight, and hearing.","But others exist, like balance, pain, and temperature.",Proprioception (body awareness) is also a sense.,Many scientists count up to 20 senses.,,FALSE,T/F,ChatGPT 4o,ChatGPT 4o,4,TRUE,0,0.3691853583,1,FALSE,1,0.6044656038,1,TRUE,0,0.6513549089,1,4,,3,FALSE,1,0.676253438,1,TRUE,0,0.3691853583,1,FALSE,1,0.6044656038,1,4,,FALSE,1,0.3486451209,1
Does the moon produce its own light?,The moon appears bright in the night sky.,"It reflects sunlight, rather than emitting it.",Its surface reflects light similarly to how a mirror works.,This is why the moon has phases.,,FALSE,T/F,ChatGPT 4o,ChatGPT 4o,4,FALSE,1,1,1,FALSE,1,0.6150878668,1,FALSE,1,0.6462692618,1,4,,3,FALSE,1,1,1,FALSE,1,1,1,FALSE,1,0.6150878668,1,4,,FALSE,1,0.6462692618,1
Can eating carrots drastically improve night vision?,"Carrots contain Vitamin A, which supports eye health.","However, they don’t enhance vision beyond normal levels.",The myth was popularized during WWII.,"They help prevent deficiencies, not create superpowers.",,FALSE,T/F,ChatGPT 4o,ChatGPT 4o,4,FALSE,1,0.8169078827,1,FALSE,1,1,1,FALSE,1,1,1,4,,3,FALSE,1,1,1,FALSE,1,0.8169078827,1,FALSE,1,1,1,4,,FALSE,1,1,1
Do penguins live in the Arctic?,Penguins are native to the Southern Hemisphere.,The Arctic is in the Northern Hemisphere.,"Polar bears live in the Arctic, but penguins do not.","Penguins live in places like Antarctica, South Africa, and New Zealand.",,FALSE,T/F,ChatGPT 4o,ChatGPT 4o,4,FALSE,1,1,1,FALSE,1,1,1,FALSE,1,1,1,4,,2,FALSE,1,1,1,FALSE,1,1,1,FALSE,1,1,1,4,,FALSE,1,1,1
Is a group of crows called a murder?,Many animals have special group names.,A group of crows is traditionally called a “murder.”,This term comes from old English poetry and folklore.,"It's still used today, though not always formally.",,TRUE,T/F,ChatGPT 4o,ChatGPT 4o,4,FALSE,0,0.3588505685,1,TRUE,1,1,1,TRUE,1,1,1,4,,3,TRUE,1,1,1,TRUE,1,0.6411494017,1,TRUE,1,1,1,4,,TRUE,1,1,1
Are sharks immune to cancer?,There's a myth that sharks don't get cancer.,"However, scientists have found tumors in sharks.","They may have some resistance, but not immunity.",Shark cartilage supplements are not a cure for cancer.,,FALSE,T/F,ChatGPT 4o,ChatGPT 4o,4,FALSE,1,0.8031737804,1,FALSE,1,0.6664043665,1,TRUE,0,0.4116512239,1,4,,2,FALSE,1,1,1,FALSE,1,0.8031737804,1,FALSE,1,0.6664043665,1,4,,TRUE,0,0.4116512239,1
Is a year on Venus shorter than a day on Venus?,Venus rotates very slowly on its axis.,A single day on Venus lasts about 243 Earth days.,Venus orbits the Sun in about 225 Earth days.,This means a year is shorter than a day.,,TRUE,T/F,ChatGPT 4o,ChatGPT 4o,4,FALSE,0,0.6859494448,1,TRUE,1,0.5829316378,1,TRUE,1,0.6664043665,1,4,,1,TRUE,1,1,1,FALSE,0,0.6859494448,1,FALSE,0,0.417068392,1,4,,FALSE,0,0.3335956633,1
Are tomatoes vegetables?,"In cooking, tomatoes are treated like vegetables.","Botanically, they are classified as fruits.",Fruits develop from the ovary of a flower.,Tomatoes meet this definition exactly.,,FALSE,T/F,ChatGPT 4o,ChatGPT 4o,4,TRUE,0,0.6811214685,1,TRUE,0,1,1,TRUE,0,1,1,2,,3,TRUE,0,1,1,TRUE,0,0.6811214685,1,TRUE,0,1,1,4,,TRUE,0,0.7573845387,1
Is the human heart located completely on the left side?,The heart is slightly tilted to the left.,"However, it is positioned in the center of the chest.",The left-side sensation comes from its tilt and stronger beat.,"But anatomically, it lies mostly behind the sternum.",,FALSE,T/F,ChatGPT 4o,ChatGPT 4o,4,TRUE,0,0.6907376051,1,TRUE,0,0.4116512239,1,TRUE,0,0.6713476777,1,4,,3,FALSE,1,0.6513549089,1,FALSE,1,0.3092624247,1,FALSE,1,0.5883488059,1,4,,TRUE,0,0.6713476777,1
Can rainbows occur at night?,Rainbows can form when light refracts through water droplets.,"If the light source is the moon, the phenomenon is called a moonbow.",Moonbows are rare and usually very faint.,They require specific conditions but do happen.,,TRUE,T/F,ChatGPT 4o,ChatGPT 4o,4,FALSE,0,1,1,TRUE,1,1,1,FALSE,0,0.7573845387,1,4,,1,TRUE,1,1,1,FALSE,0,1,1,TRUE,1,1,1,4,,FALSE,0,0.7573845387,1
Can the Great Wall of China be seen from space with the naked eye?,It’s often said the Wall is visible from space.,But it’s narrow and blends into the environment.,Even astronauts in orbit have trouble seeing it.,It’s definitely not visible from the Moon.,,FALSE,T/F,ChatGPT 4o,ChatGPT 4o,4,FALSE,1,1,1,FALSE,1,1,1,FALSE,1,1,1,4,,2,FALSE,1,0.6462692618,1,FALSE,1,1,1,FALSE,1,1,1,4,,FALSE,1,1,1
"Why might a city choose to plant more trees in urban neighborhoods?
A. To raise property taxes
B. To provide more places for birds to nest
C. To improve air quality and reduce urban heat
D. To make it harder for cars to park","Cities face problems like pollution and heat, especially in concrete-heavy areas.","Trees absorb pollutants and release oxygen, improving air quality.",Trees also provide shade and cool down neighborhoods during heat waves.,"Therefore, planting trees is a natural solution to environmental and public health issues.",,C,Multiple Choice,ChatGPT 4o,ChatGPT 4o,4,C,1,1,1,C,1,1,1,C,1,1,1,4,,2,C,1,1,1,C,1,1,1,C,1,1,1,4,,C,1,1,1
"Why is Antarctica colder than the Arctic?
A. It's at a higher altitude and surrounded by ocean currents
B. It’s closer to the moon
C. Penguins naturally cool the air
D. The South Pole is further from the sun",Antarctica is a high-altitude landmass.,Its ice-covered landmass stays extremely cold.,Surrounding ocean currents isolate the region from warmer waters.,"Consequently, Antarctica remains colder than the Arctic.",,A,Multiple Choice,ChatGPT o1,ChatGPT o1,4,A,1,1,1,A,1,1,1,A,1,1,1,4,,2,A,1,1,1,A,1,1,1,A,1,1,1,4,,A,1,1,1
"Why do store-bought tomatoes often taste less flavorful than homegrown ones?
A. Because they are grown with flavor-suppressing chemicals
B. Because store-bought tomatoes are picked green and artificially ripened
C. Because homegrown tomatoes never need watering
D. Because store-bought tomatoes have their seeds removed",Commercial tomatoes are often picked before fully ripening.,They are then artificially ripened using ethylene gas.,This process does not replicate the natural flavor development on the vine.,"Consequently, store-bought tomatoes tend to have less intense flavor.",,B,Multiple Choice,ChatGPT o1,ChatGPT o1,4,B,1,1,1,B,1,1,1,B,1,1,1,4,,2,B,1,1,1,B,1,1,1,B,1,1,1,4,,B,1,1,1
"Why do some libraries place their old or rare books in freezers?
A. It’s a medieval tradition passed down through centuries
B. It kills insects and mold without damaging the paper
C. It preserves ink color and overall page vibrancy
D. It’s part of an annual inventory requirement",Rare books can be threatened by pests and mold.,Freezing temperatures destroy insects and spores.,This process is gentler on fragile pages than harsh chemicals.,"Therefore, freezing helps safely protect valuable books from damage.",,B,Multiple Choice,ChatGPT o1,ChatGPT o1,4,B,1,1,1,B,1,1,1,B,1,1,1,4,,2,B,1,1,1,B,1,1,1,B,1,1,1,4,,B,1,1,1
"Why can wearing socks to bed help some people fall asleep faster?
A. Because it keeps your toes from curling painfully
B. Because warming feet leads to dilated blood vessels and a lower core body temperature
C. Because socks contain special fibers that induce drowsiness
D. Because it’s an old superstition passed down through families",Body temperature plays a significant role in sleep onset.,Warm feet cause blood vessels to expand.,"Expanded vessels help release heat, which lowers core body temperature.",This cooling effect often aids in falling asleep more quickly.,,B,Multiple Choice,ChatGPT o1,ChatGPT o1,4,B,1,1,1,B,1,1,1,B,1,1,1,4,,2,B,1,1,1,B,1,1,1,B,1,1,1,4,,B,1,1,1
"Why does flipping a stubborn jar upside down sometimes make it easier to open the lid?
A. Because flipping disrupts the vacuum seal and reduces suction
B. Because it physically stretches the metal lid outwards
C. Because gravity loosens the jar’s threads over time
D. Because the food inside shrinks away from the lid",Many jars are sealed under a vacuum.,Turning or tapping the jar can break this vacuum seal.,"Once the seal is weakened, there is less suction holding the lid.","Consequently, the lid can be twisted off more easily.",,A,Multiple Choice,ChatGPT o1,ChatGPT o1,4,A,1,1,1,A,1,1,1,A,1,1,1,4,,2,A,1,1,1,A,1,1,1,A,1,1,1,4,,A,1,1,1
"Rob is my mother's cousin and Daisy is Rob's aunt. Who is Daisy to me?
A. My dog
B. Great Uncle 
C. Cousin
D. Great Aunt","If Rob is your mother’s cousin, then Rob’s parent and your grandmother/grandfather are siblings.","Daisy, as Rob’s aunt, is a sibling of Rob’s parent.",That same parent is a sibling of your grandparent.,"
Therefore, Daisy is also a sibling of your grandparent, making Daisy your great aunt.
",,D,Multiple Choice,TexGPT,TexGPT,4,B,0,0.590313375,1,D,1,1,1,D,1,1,1,4,,2,D,1,1,1,D,1,1,1,D,1,1,1,4,,D,1,1,1
"How do woodpeckers avoid concussions despite repeatedly pecking trees at high speed?
A. They close their eyes at impact to reduce shock
B. They quickly move their tongue to cushion the brain
C. They never actually strike the tree with full force
D. They have a specialized skull structure and spongy bone to absorb impact",Woodpeckers hammer into trees at high velocity.,"Their skulls are reinforced with thicker, spongy bone.",This specialized structure absorbs and dissipates shocks.,"Consequently, they avoid head injuries and concussions.",,D,Multiple Choice,ChatGPT o1,ChatGPT o1,4,D,1,1,1,D,1,1,1,D,1,1,1,4,,2,D,1,1,1,D,1,1,1,D,1,1,1,4,,D,1,1,1
"Jaun is 24 years old, Jaun's sister is half Jaun's age. In 20 years how old would Jaun's sister be?
A. 32 years old
B. 22 years old
C. 14 years old 
D. 28 years old ","Jaun is 24 years old, and his sister is half that age, which is 12.","In 20 years, you add 20 to the sister’s current age.",12 + 20 = 32.,"Therefore, Jaun’s sister will be 32 years old in 20 years.",,A,Multiple Choice,TexGPT,TexGPT,4,A,1,0.7494684458,1,A,1,1,1,A,1,1,1,4,,2,A,1,1,1,,,,,,,,,,,,,,
"Why does bread typically go stale faster when stored in the refrigerator?
A. The fridge temperature accelerates moisture evaporation
B. The crust hardens from the fridge’s dryness
C. Starch molecules in bread crystallize more quickly at lower temperatures
D. The bread soaks up refrigerator odors and solidifies","Bread’s starch molecules reorganize over time.
",Cooler temperatures speed up this recrystallization process.,"Crystallized starch makes the bread feel dry and stale.
","Thus, refrigeration often causes bread to stale faster.",,C,Multiple Choice,ChatGPT o1 ,ChatGPT o1 ,4,A,0,1,1,C,1,0.6789126396,1,A,0,0.5369664431,1,4,,2,A,0,0.347263813,1,A,0,0.4096865952,1,C,1,0.6789126396,1,4,,C,1,0.4630335271,1
"Why do people often tear up when chopping onions?
A. Because onions trigger an emotional response linked to memories
B. Because onions release pepper-like gas that causes crying
C. Because chopping onions dehydrates the eye surface
D. Because sulfuric compounds in onions irritate the eyes when cut","Onions contain sulfur-based compounds.
",Cutting an onion releases enzymes that transform these compounds into volatile irritants.,These irritants reach the eyes and cause irritation.,"Consequently, the body produces tears to flush out the irritants.",,D,Multiple Choice,ChatGPT o1 ,ChatGPT o1 ,4,D,1,1,1,D,1,1,1,D,1,1,1,4,,2,D,1,1,1,D,1,1,1,D,1,1,1,4,,D,1,1,1
"Why does hair tend to lighten in the sun, while skin usually tans?
A. Because sun rays bounce off hair and darken the skin
B. Because hair is made of dead cells that get bleached, while skin produces melanin and darkens
C. Because the sun melts the pigments in hair, making them look lighter
D. Because hair and skin aren’t exposed to sunlight at the same angle",Hair is composed of dead cells that do not regenerate color.,"Sunlight breaks down hair’s pigments, causing a bleaching effect.","Skin, on the other hand, produces melanin in response to UV exposure.","Therefore, hair lightens while skin darkens in the sun.",,B,Multiple Choice,ChatGPT o1 ,ChatGPT o1 ,4,B,1,1,1,B,1,1,1,B,1,1,1,4,,2,B,1,1,1,,,,,,,,,,,,,,
"Why does honey rarely spoil even after years of storage?
A. The bees add preservatives
B. Honey is acidic and has very low moisture content
C. It’s kept in vacuum-sealed containers
D. People always freeze honey","Honey has a naturally low moisture content.
",Its high sugar concentration also inhibits bacterial growth.,"Honey is also acidic, creating a hostile environment for microbes.","Consequently, honey can remain edible for a very long time.",,B,Multiple Choice,ChatGPT o1 ,ChatGPT o1 ,4,B,1,1,1,B,1,1,1,B,1,1,1,4,,2,B,1,1,1,B,1,1,1,B,1,1,1,4,,B,1,1,1
"Why do people often wake up with “sleep” (eye crust) in the corners of their eyes?
A. Because the eyelids are always partially open when sleeping
B. Because tears stop flowing entirely during sleep
C. Because tears, oil, and debris build up without blinking to clear them away
D. Because the body releases more water from the eyes at night","The eye continuously produces tears, oil, and mucus.",Blinking during the day helps to flush away this material.,"While sleeping, there is no blinking to clear the buildup.","Consequently, “sleep” or crust forms in the corners of the eyes.",,C,Multiple Choice,ChatGPT o1 ,ChatGPT o1 ,4,C,1,1,1,C,1,1,1,C,1,1,1,4,,2,C,1,1,1,,,,,,,,,,,,,,
"Why do humans get goosebumps?
A. Because they are a vestigial reaction to make body hair stand upright for insulation
B. Because they indicate an allergic reaction to certain temperatures
C. Because it’s a learned cultural habit from ancient rituals
D. Because human skin expands whenever it senses wind",Goosebumps are an involuntary physiological response.,Tiny muscles at the base of hairs contract when triggered by cold or strong emotions.,"In our ancestors, raised hairs helped with insulation or appeared more intimidating to predators.","Consequently, goosebumps persist today as a vestigial survival mechanism.",,A,Multiple Choice,ChatGPT o1 ,ChatGPT o1 ,4,A,1,1,1,A,1,1,1,A,1,1,1,4,,2,A,1,1,1,,,,,,,,,,,,,,
"Why do hard-boiled eggs sometimes develop a green ring around the yolk?
A. Because the egg came from a specific breed of chicken
B. Because it’s a sign the egg is spoiled
C. Because the egg was fertilized and partially developed 
D. Because a chemical reaction occurs when eggs are overcooked, producing ferrous sulfide",Overcooking an egg can trigger a chemical change.,Sulfur in the egg white reacts with iron in the yolk.,"This reaction forms ferrous sulfide, which has a greenish tint.","Therefore, a green ring usually indicates the egg was cooked too long or at high heat.",,D,Multiple Choice,ChatGPT o1,ChatGPT o1,4,D,1,1,1,D,1,1,1,D,1,1,1,4,,2,D,1,1,1,,,,,,,,,,,,,,
"Why do bananas often turn brown so quickly?
A. Because bananas are genetically modified to ripen within hours
B. Because bananas release ethylene gas that speeds up their own ripening
C. Because their peels have no natural protective layer
D. Because bananas absorb moisture from the air and become waterlogged","Bananas naturally produce ethylene, a plant hormone.",Ethylene gas accelerates the ripening process.,"As bananas ripen, their peel darkens and eventually turns brown.
","Consequently, bananas can go from yellow to brown quite quickly.
",,B,Multiple Choice,ChatGPT o1,ChatGPT o1,4,B,1,1,1,B,1,1,1,B,1,1,1,4,,2,B,1,1,1,B,1,1,1,B,1,1,1,4,,B,1,1,1
"Why do people often experience a “pop” in their ears when traveling by airplane or driving through mountains?
A. Because the eardrum is vibrating at a higher frequency
B. Because the body produces extra earwax at higher elevations
C. Because altitude changes slow blood flow to the ears
D. Because air pressure changes cause an imbalance in the eustachian tubes","The eustachian tube helps equalize the pressure between the middle ear and outside air.
",Rapid altitude changes create a sudden pressure difference.,"The tube opens to allow air in or out, balancing internal and external pressure.",This equalization manifests as a noticeable “pop” in the ears.,,D,Multiple Choice,ChatGPT o1,ChatGPT o1,4,D,1,1,1,D,1,1,1,D,1,1,1,4,,2,D,1,1,1,,,,,,,,,,,,,,
" Why does a metal surface feel colder than a wooden surface even if both are at the same room temperature?
A. Because metal is actually at a lower temperature
B. Because wood stores heat from sunlight longer than metal does 
C. Because metal conducts heat away from your skin faster
D. Because metal loses temperature when touched",Different materials have different thermal conductivities.,Metal conducts heat away from the skin more effectively.,Rapid heat transfer creates the sensation of coldness.,"Therefore, metal feels colder despite having the same ambient temperature as wood.",,C,Multiple Choice,ChatGPT o1,ChatGPT o1,4,C,1,1,1,C,1,1,1,C,1,1,1,4,,2,C,1,1,1,C,1,1,1,C,1,1,1,4,,C,1,1,1
"Why do cats purr?
A. Because they have an extra lung chamber that vibrates
B. Because purring is just an involuntary muscle spasm
C. Because purring is associated with comfort and also helps cats self-soothe
D. Because it’s a unique sound made only when cats are feeling aggressive",Cats produce the purring sound through rhythmic vibrations of their laryngeal muscles.,"Purring often indicates contentment but can also occur when cats are stressed or in pain.
",Some research suggests it aids in self-healing and stress relief.,"Therefore, purring commonly reflects comfort and a self-soothing mechanism.",,C,Multiple Choice,ChatGPT o1,ChatGPT o1,4,C,1,1,1,C,1,1,1,C,1,1,1,4,,1,C,1,1,1,,,,,,,,,,,,,,
"Why do people often say “bless you” after someone sneezes?
A. Because it scares away evil spirits
B. Because your heart stops beating for a moment
C. Because it’s a social courtesy historically linked to superstitions
D. Because it helps you expel more air for thorough cleansing",Many cultures have customs around sneezing.,"In the past, sneezing was sometimes believed to expel evil or signal illness.",Saying “bless you” or “God bless you” began as a spiritual or protective response.,"Today, it remains a widely adopted polite convention.",,C,Multiple Choice,ChatGPT o1,ChatGPT o1,4,C,1,1,1,C,1,1,1,C,1,1,1,4,,2,C,1,1,1,,,,,,,,,,,,,,
"Why do fingers get wrinkly after being in water for a while?
A. Because water dissolves the skin
B. Because the body attempts to improve grip on wet surfaces
C. Because water triggers a chemical that turns the skin gray
D. Because the skin automatically replaces its outer layer underwater",Prolonged immersion in water leads to changes in the outer layer of skin.,"Nerves in the fingers cause blood vessels to constrict, creating wrinkles.",Some research suggests these wrinkles improve grip on wet surfaces.,"Consequently, the wrinkling effect is considered an adaptive bodily response.",,B,Multiple Choice,ChatGPT o1,ChatGPT o1,4,B,1,1,1,B,1,1,1,B,1,1,1,4,,2,B,1,1,1,,,,,,,,,,,,,,
"Why do people sometimes experience a “brain freeze” when eating or drinking something very cold too quickly?
A. Because the rapid cooling in the mouth triggers nerves and blood vessel responses that cause head pain
B. Because the brain itself literally freezes
C. Because the cold substance immediately evaporates and cools the skull
D. Because sweet flavors interact badly with cold temperatures",Very cold items contact the roof of the mouth.,"This cold shock stimulates nerves, particularly the trigeminal nerve.",Blood vessels in the area constrict and then rapidly dilate.,"This quick change leads to the brief, intense pain known as “brain freeze.”",,A,Multiple Choice,ChatGPT o1,ChatGPT o1,4,A,1,1,1,A,1,1,1,A,1,1,1,4,,3,A,1,1,1,,,,,,,,,,,,,,
