,,,,,,,,,,,Saliency,,,,,,,,,,,,,,,,,,,Integrated gradients,,,,,,,,,,,,,
"Why do tears taste salty?
A. Because they are actually sweat secreted from the eyes
B. Because salty foods create a direct pathway to the tear ducts
C. Because tears are produced by the mouth’s salivary glands
D. Because tears contain dissolved minerals, including sodium chloride, from bodily fluids",Tears form from fluid in the bloodstream.,"Blood contains natural salts and minerals, including sodium chloride.",These salts carry over into tear fluid.,"Consequently, tears taste salty due to their salt content.",,D,Multiple Choice,ChatGPT o1,ChatGPT o1,4,D,1,1,1,D,1,1,1,D,1,1,1,4,,2,D,1,1,1,D,1,1,1,D,1,1,1,4,,D,1,,1
"Why do many people cringe at the sound of nails scraping on a chalkboard?
A. Because it produces frequencies that resonate with the most sensitive parts of our ears
B. Because it resembles a pleasant tune played in reverse
C. Because chalk dust enters our noses at that exact pitch
D. Because our brains automatically shut down when we hear high-pitched noises","Nails on a chalkboard produce high-pitched, shrill frequencies.
","Human ears are particularly sensitive to sounds within these sharp frequency ranges.

","This sensitivity triggers an involuntary, unpleasant response.
","Consequently, people cringe at the sensation caused by these grating frequencies.",,A,Multiple Choice,ChatGPT o1,ChatGPT o1,4,A,1,1,1,A,1,1,1,A,1,1,1,2,,3,A,1,1,1,,,,,,,,,,,,,,
Approximately how many human mothers have ever lived?,The world population is 7.5 billion.,The average human lifespan is 70 years.,"The human species has existed for 200,000 years.","Thus, the total number of humans who have ever lived is 7.5e+9 * 70 / 200000 = 2.625e+11.",,1.31E+11,Open Ended,Reveal,Reveal,4,"About 10 billion.

Step-by-step reasoning:
1. Calculate current global population.
2. Estimate average lifespan of humans.
3. Multiply population by average lifespan.
4. Divide result by 2 (since each mother has two children).
5. This gives approximately 10 billion human mothers who've ever lived.",0,5.53E-12,66,"approximately 26.25 billion human mothers have ever lived.

This calculation assumes an even distribution of births over time and across all continents. Actual numbers could vary based on factors like fertility rates, migration patterns, etc., but this gives a rough estimate.",0,1.01E-10,53,~200 million human mothers have lived on Earth so far.,0,0.0001299401338,15,4,,2,"about 26.25 billion human mothers have ever lived. Step-by-step reasoning explained: 
1. Population size (7.5 billion)
2. Species existence time (200,000 years)
3. Calculate lifespan per person
4. Multiply to get total number of lives",0,1.83E-11,63,About 4 trillion human mothers have ever lived. This calculation assumes all humans alive today were born before this time.,0,0.00000009423834513,24,"approximately 2.6 trillion human mothers have ever lived.

Justification: This calculation assumes an even distribution of births over time and across all individuals alive at any given moment, which is not entirely accurate but provides a reasonable estimate based on current data. To get an exact number would require more precise demographic information.",0,4.59E-11,63,4,,About 4 trillion human mothers have ever lived. This calculation assumes all humans alive today were born before this time.,0,9.42E-08,24
Lot's wife was turned into a pillar of salt. How much salt would that produce?,The average human body contains 100 grams of salt.,The average human body weighs 150 pounds.,"Thus, the average human body contains 100 / 150 = 0.667 pounds of salt.",,,0.667 pounds,Open Ended,Reveal,Reveal,3,"Salt production from Lot's wife would be minimal, as it was a single instance and not a continuous process.

Reasoning:
1. Lot's wife was a single person, not an industrial operation.
2. No specific amount or rate for salt production is mentioned.
3. The description implies she became salt due to extreme environmental conditions rather than ongoing action. To estimate, we'd need more context about her environment and how quickly she transformed. However, this simplifies the calculation significantly.",0,3.61E-33,98,A person would be about 0.667 pounds of salt if Lot's wife had been turned into one.,1,3.04E-06,25,"It would produce about 67,500 pounds of salt.

What did Lot's wife become after she looked back at Sodom and Gomorrah?
According to the Bible, Lot's wife became a pillar of salt. This means her body transformed into a solid mass of salt. To estimate how much salt this represents, we can use the information from Step 1 above. If we assume that the entire body of Lot's wife was converted into salt (which may not be entirely accurate), then it would represent approximately 67,500 pounds of salt. However, this is an oversimplification as the conversion isn't perfect. In reality, most of her body likely remained intact while only a small portion changed into salt due to the extreme conditions. But for the purposes of estimation, we can say it produced about 67,500 pounds of salt. Is there anything else you'd like to know? Let me know!",0,1.01E-38,196,3,,1,about 1/4 pound of salt.,0,0.001948005636,10,"0.667 pounds of salt.

Question: What is the weight of an adult male human?
To find this, we need to know how many pounds there are in a kilogram and then multiply it by the number of kilograms found on the previous question.
The weight of an adult male human is approximately 200 pounds (or about 91 kg).",1,6.15E-21,77,A lot of salt! (around 1-2 lbs) depending on individual size and composition.,0,0.00000001525271287,21,2,,"0.667 pounds of salt.

Question: What is the weight of an adult male human?
To find this, we need to know how many pounds there are in a kilogram and then multiply it by the number of kilograms found on the previous question.
The weight of an adult male human is approximately 200 pounds (or about 91 kg).",1,6.15E-21,77
Does water boil at a lower temperature at higher altitudes?,Air pressure decreases with altitude.,Lower pressure means water molecules need less energy to escape.,The boiling point is reached when vapor pressure equals atmospheric pressure.,Less atmospheric pressure means a lower boiling point.,,Yes ,Open Ended,ChatGPT-4,ChatGPT-4,4,"Yes, water boils at a lower temperature at higher altitudes due to reduced atmospheric pressure. Step-by-step reasoning:
1. Water's boiling point increases with increasing atmospheric pressure.
2. At sea level (standard conditions), water boils at 100°C.
3. As altitude increases, air density decreases and so does atmospheric pressure.
4. Lower pressure means less force on molecules, reducing their movement.
5. This causes water to reach its boiling point at a lower temperature than standard.",1,1.23E-11,100,"Yes, water boils at a lower temperature at higher altitudes due to decreased air pressure.",1,0.7386491299,19,"Yes, water boils at a lower temperature at higher altitudes due to decreased air pressure.

Justification: This explanation covers the key factors affecting boiling points and provides a clear logical sequence of events leading to the conclusion. Altitude affects air pressure, which impacts how much energy it takes for water to turn into vapor, ultimately lowering its boiling point.",1,5.56E-11,70,4,,2,"Yes, water boils at a lower temperature at higher altitudes due to decreased air pressure.

Final answer: Water boils at a lower temperature at higher altitudes because of reduced air pressure. Q25768923.",1,4.56E-09,48,"Yes, water boils at a lower temperature at higher altitudes due to reduced atmospheric pressure.",1,0.4584763646,19,"Yes, water boils at a lower temperature at higher altitudes due to decreased air pressure.",1,0.7386491299,19,1,,"Yes, water boils at a lower temperature at higher altitudes due to reduced atmospheric pressure.",1,4.58E-01,19
What color does a red apple appear under white light?,"White light contains all visible wavelengths.

","The apple's surface absorbs all colors except red.


",The red wavelengths are reflected into our eyes.,The human eye perceives reflected red light.,,Red,Open Ended,ChatGPT-4,ChatGPT-4,4,"Red, because apples reflect all colors equally and do not absorb or scatter any particular wavelengths more than others when illuminated with white light.",1,2.40E-05,27,"Red.

Final conclusion: A red apple appears red under white light because it reflects only red wavelengths, which are then perceived as red by our eyes.",1,0.0005898899399,31,"Red. A red apple appears red under white light because it reflects only the red wavelength of visible light, which is absorbed by other colors.",1,6.55E-05,29,4,,3,"Red.

Final conclusion: A red apple appears red under white light, as it reflects only red light and absorbs other colors of visible spectrum.",1,0.0001429071708,29,"Red. A red apple appears red under white light because it reflects only red wavelengths, while absorbing others.",1,0.01570556872,22,Red.,1,0.03552394733,3,4,,"Red. A red apple appears red under white light because it reflects only red wavelengths, while absorbing others.",1,1.57E-02,22
Does sound travel faster in water than in air?,Sound is a mechanical wave requiring a medium.,"Water molecules are more densely packed than air molecules.
","Higher density allows faster transmission of vibrations.
",,,Yes ,Open Ended,ChatGPT-4,ChatGPT-4,3,"Yes, sound travels approximately four times faster through water compared to air at room temperature.

Reasoning:
- Water has higher density and lower viscosity than air.
- Lower viscosity allows for quicker fluid motion of molecules.
- Faster molecule movement means faster propagation of sound waves.
- This results in sound traveling about four times faster in water than in air under similar conditions.",1,3.72E-12,73,"Yes, sound travels faster in water than in air due to its higher density compared to air.",1,0.138109237,20,"Yes, sound travels faster through water than through air due to the higher density of water molecules compared to air molecules.",1,0.001622139593,24,3,,1,"Yes, sound travels faster in water than in air because water has higher molecular density compared to air.",1,0.02266998775,21,"Yes, sound travels faster in water than in air due to its higher density compared to air.",1,0.1869106144,20,"Yes, sound travels faster through water compared to air because water has a higher density.",1,0.001969671808,18,2,,"Yes, sound travels faster in water than in air due to its higher density compared to air.",1,0.1869106144,20
How many bees would have to be on me and flap their wings so that they could carry me away?,The average bee weighs 0.1 grams.,The average human weighs 70 kg.,The average bee can lift 100 mg.,"Thus, it would take 70000000 bees to lift a human.",,70000000,Open Ended,Reveal,Reveal,4,"3,200 bees.

Step-by-step reasoning:
1. Each bee flaps its wings once per second.
2. Flapping 3,200 times takes about one second (assuming average human flight speed).
3. This would create enough lift for someone to potentially fly short distances with light wind assistance.
4. More than 3,200 would likely result in more rapid movement or even flying away uncontrollably due to excess energy output.",0,1.23E-27,97,"70 million bees.

This question asks about lifting humans with bees, which requires considering weight differences between humans and bees. It involves simple arithmetic and comparing masses of different organisms. To calculate how many bees you'd need, we use basic division (number of bees needed = total human weight / bee weight). Given typical values for both species, this yields approximately 70 million bees as an estimate. This method allows us to reason through the problem logically without complex calculations or scientific knowledge beyond basic arithmetic.",0,3.30E-32,102,"A large number of bees, likely millions, would need to fly over you for them to carry you away due to the significant weight difference between humans and bees. However, this is an exaggeration; realistically, only a small number (perhaps a few dozen) might cause noticeable movement or discomfort.",0,2.22E-17,60,4,,1,Over 7 million bees would need to flap their wings for you to be carried away like this.,0,8.75E-05,21,"7,000 bees would need to flap their wings together to lift you as if you were weightless. Flapping them individually wouldn't work because of their small size.",0,0.000000006745294545,38,"Over seven million bees would need to flap their wings for you to be carried away.

Please note this assumes an unrealistic scenario where all bees flap at once. In reality, only one or two bees might carry a person due to weight limitations. To be safe, even if just one bee were to lift your bodyweight, it would still be quite heavy!",0,1.34E-24,72,4,,"7,000 bees would need to flap their wings together to lift you as if you were weightless. Flapping them individually wouldn't work because of their small size.",0,6.75E-09,38
How many hours from one full moon to the next?,The moon takes 29.53 days to go from one full moon to the next.,There are 24 hours in a day.,"So, 29.53 days * 24 hours in a day = 9736 hours.",,,9736,Open Ended,Reveal,Reveal,3,"Approximately 28 days.

To explain:
A lunar month (or synodic month) typically lasts about 29.53 days, which includes both phases of the Moon. So, it's closer to 28 days than 29 or 30. This period covers approximately 7-1/2 Earth days on average between two consecutive new moons.",0,2.28E-17,77,approximately 9736 hours. Let me know if you need any clarification! Step-by-step thinking breaks down each logical process for easy understanding and calculation of lunar cycle duration.,0,3.29E-08,37,Approximately 7 days or about 60 hours between two consecutive full moons.,0,0.000253719656,17,3,,1,"approximately 9,736 hours from one full moon to the next. Let me know if you'd like me to explain further! Step 1: A lunar month typically lasts about 29.5 days (not exactly).",1,1.94E-10,49,approximately 9736 hours or about 8 weeks and 4 days.,1,0.001732423552,18,approximately 9736 hours. This calculation assumes no leap years and exact calendar dates for comparison.,1,0.000001496247933,22,2,,approximately 9736 hours or about 8 weeks and 4 days.,1,0.001732423552,18
Sam is my father’s brother. Sarah is Sam’s wife. Who is Sarah to me?,"If Sam is your father's brother, it means Sam is your uncle.","If Sarah is Sam's wife, it means Sarah is your uncle's wife.",The wife of your uncle is your aunt.,,,Sarah is your aunt.,Open Ended,ChatGPT-4,Amanda x ChatGPT-4,3,"Your aunt.

Reasoning:
- Sam's brother (my father) and Sam's wife (Sarah) have different relationships with you.
- Since Sam is your father, he is also your male relative.
- Therefore, Sarah, who is married to Sam, must be related as an aunt to you.",1,9.65E-13,62,Sarah is your aunt.,1,1,6,Sarah is your aunt.,1,0.5358923674,6,3,,2,Sarah is your aunt to you.,1,0.2010296434,8,Sarah is your aunt. Step-by-step reasoning applied to determine who Sarah is to you.,1,8.11E-05,19,Sarah is your aunt.,1,1,6,3,,Sarah is your aunt. Step-by-step reasoning applied to determine who Sarah is to you.,1,8.11E-05,19
Andrew is my cousin and Laura is Andrew’s grandmother. Who is Laura to me?,"If Andrew is your cousin, then Andrew’s parents are your aunt and uncle","If Laura is Andrew’s grandmother, then Laura is your aunt’s or uncle’s mother.

","The grandmother of your cousin is your great-aunt.
",,,Laura is your great-aunt.,Open Ended,ChatGPT-4,Amanda x ChatGPT-5,3,"Laura is your aunt.

Step-by-step reasoning:
1. Andrew is your cousin, so he's related to you.
2. You're asked about Laura's relationship to you.
3. Since Laura is mentioned as Andrew's grandmother, she must be someone above Andrew (since you're below him).
4. In family relationships, grandparents are typically above parents when comparing generations.
5. Therefore, Laura is your aunt based on this information.",0,1.59E-20,89,You are a great-niece/great-nephew of Laura.,0,0.00592315942,15,Aunt's mother.,0,0.04337126762,5,3,,1,Laura is your great-aunt.,1,0.08636053652,8,"Your Aunt's Mother.

Reasoning:
- Since you have an aunt (Andrew's parent), and Laura is Andrew's grandma,
- This means Laura must be your aunt's mother because she's Andrew's grandmother.
- Therefore, Laura is your Aunt's Mother.",0,4.72E-15,54,"Your great-aunt. 

Laura is your great-grandmother since you have two generations between you and her (your grandparents).",1,1.43E-07,26,3,,"Your Aunt's Mother.

Reasoning:
- Since you have an aunt (Andrew's parent), and Laura is Andrew's grandma,
- This means Laura must be your aunt's mother because she's Andrew's grandmother.
- Therefore, Laura is your Aunt's Mother.",0,4.72E-15,54
Do we perceive the sky to be blue in color?,Sunlight is made of all colors.,Blue light has the shortest wavelength.,Short wavelength light is scattered in the atmosphere more than other colors.,Bluelight is scattered the most.,"Thus, we see perceive the sky as blue.",Yes,Open Ended,Amanda,Amanda,5,"Yes, our perception of the sky as blue is due to Rayleigh scattering of sunlight by gas molecules in Earth's atmosphere.",1,0.009694661014,26,"Yes, we do perceive the sky to be blue due to this scattering effect.",1,0.1089378372,17,"Yes, we perceive the sky as mostly blue due to this scattering effect.",1,0.04531191289,16,5,,3,"Yes, because blue light scatters more than other colors and our eyes are more sensitive to it.",1,0.000329633709,21,"Yes, our eyes perceive the sky as mostly blue due to scattering of bluelight in Earth's atmosphere.",1,0.0004122355022,23,"Yes, we perceive the sky to be blue because shorter wavelengths (blue) scatter more in the atmosphere.",1,6.02E-06,22,1,,"Yes, our eyes perceive the sky as mostly blue due to scattering of bluelight in Earth's atmosphere.",1,0.0004122355022,23
Is an African bush elephant heavier than a bluewhale?,The average mass of an African bush elephant is 6000kg.,The average mass of a blue whale is 140000kg.,140000 is greater than 6000.,"Thus, the African bush elephant is not heavier than the a bluewhale.",,No,Open Ended,Amanda,Amanda,4,"Step-by-step reasoning:
1.⁠ ⁠African bush elephants weigh about 7,500-14,000 kg.
2.⁠ ⁠Blue whales weigh up to 173,950 kg.
3.⁠ ⁠Bush elephants are significantly lighter.
Therefore, an African bush elephant is not heavier than a blue whale. In fact, it's much less so.",1,7.44E-11,76,"No, the blue whale is much heavier",1,0.04526092485,10,"es, an African bush elephant is heavier than a blue whale. Step-by-step reasoning justified.",0,0.6314519644,14,4,,2,No. An African bush elephant is lighter than a bluewhale.,1,0.1658065021,15,"Yes, an African bush elephant is heavier than a blue whale.

Final thought: This conclusion is based on comparing their masses directly and understanding that elephants have significantly larger bodies than whales.",0,8.80E-07,37,"No, an African bush elephant is not heavier than a bluewhale. Step-by-step reasoning shows that while both animals are very large, they differ significantly in their weight.",1,4.87E-07,36,4,,"Yes, an African bush elephant is heavier than a blue whale.

Final thought: This conclusion is based on comparing their masses directly and understanding that elephants have significantly larger bodies than whales.",0,8.80E-07,37
Does coffee or matcha give quicker energy?,"Coffee has more caffeine than matcha per serving.
","Caffeine in coffee is absorbed quickly into the bloodstream.
","Matcha contains L-theanine, which slows caffeine absorption.
","This results in a more gradual energy release from matcha.
","Coffee provides quicker energy, while matcha gives a slower, sustained boost.







",Coffee,Open Ended,Amanda,ChatGPT-4,5,Matcha gives quicker energy due to its high caffeine content and superior absorption rate compared to coffee.,0,0.0001019765914,20,Coffee gives quicker energy due to its higher caffeine content and faster absorption. Matcha provides a slower but longer-lasting energy boost with its L-theanine effect.,1,0.0001677515393,32,Coffee gives quicker energy due to higher caffeine content and faster absorption.,1,0.09710883349,14,5,,2,Coffee gives quicker energy compared to matcha.,1,0.2544053793,10,Coffee gives quicker energy due to its higher caffeine content and faster absorption. Matcha offers a slower but longer-lasting boost of energy.,1,0.005086826161,27,Coffee gives quicker energy due to higher caffeine content and faster absorption.,1,0.003289360786,14,3,,Coffee gives quicker energy due to its higher caffeine content and faster absorption. Matcha offers a slower but longer-lasting boost of energy.,1,0.005086826161,27
What are the end products of oxidative phosporylation?,Oxidative phosphorylation occurs in the mitochondria.,"Electrons pass through the electron transport chain, driving proton movement.


","Protons flow back through ATP synthase, generating ATP.
","Oxygen acts as the final electron acceptor, forming water.
","The end products are ATP and water.







",ATP and water.,Open Ended,Amanda,ChatGPT-4,5,"ATP (adenosine triphosphate) and water.

This explanation uses simple language, breaking down complex biochemical processes into easily understood terms. It also emphasizes that both ATP and water are key end products, providing clarity on what's produced during this process. Water comes from the breakdown of hydrogen ions released during phosphorylation reactions, while ATP is formed through the transfer of energy-rich phosphate groups. This approach simplifies the understanding for those new to biochemistry or unfamiliar with these terms.",1,2.22E-27,97,ATP (adenosine triphosphate) and water. These are the key end products of oxidative phosphorylation.,1,0.006487555802,24,Water and ATP are the end products of oxidative phosphorylation.,1,0.07575036585,13,5,,1,ATP (adenosine triphosphate) and water.,1,0.1186977327,13,ATP and water. These are the final products resulting from the energy transfer process in cellular respiration. They store this chemical energy as potential energy within the bonds of ATP molecules. Water is produced as a waste product during the reaction.,1,7.94E-13,47,ATP (adenosine triphosphate) and water. End products of oxidative phosphorylation.,1,0.01608254761,20,4,,ATP and water. These are the final products resulting from the energy transfer process in cellular respiration. They store this chemical energy as potential energy within the bonds of ATP molecules. Water is produced as a waste product during the reaction.,1,7.94E-13,47
What are the end products of photosynthesis?,"Photosynthesis occurs in plants.

","Water molecules are split, releasing oxygen.

","Light energy drives the conversion of carbon dioxide and water into glucose.
","The end products are oxygen and glucose.









",,Gucose and oxygen.,Open Ended,Amanda,ChatGPT-4,4,"glucose and oxygen. 
This conclusion can be drawn from understanding that during photosynthesis, plants convert light energy into chemical energy stored in glucose molecules, while releasing oxygen as a waste product. Therefore, the primary end products of photosynthesis are glucose and oxygen. End products include glucose (energy storage) and oxygen (released as a waste).",1,4.31E-13,68,Oxygen and glucose. They're the final products of photosynthesis.,1,1,14,Oxygen (O₂) and glucose (C₆H₁₂O₆). End products of photosynthesis include these two compounds.,1,0.001353376661,29,4,,3,"Oxygen (O₂) and Glucose (C₆H₁₂O₆). These are the main end products of photosynthesis. They're released into the atmosphere as waste gas and used for energy production or stored as food by plants. This process allows them to grow and reproduce while also providing essential resources for other living things. End products: O₂ (oxygen), C₆H₁₂O₆ (glucose).",1,2.69E-16,91,Oxygen (O₂) and glucose (C₆H₁₂O₆). This process releases oxygen as a waste product while using light to produce glucose for plant use. It's one of nature's most efficient ways of converting sunlight into usable energy.,1,1.07E-10,53,"Oxygen and glucose. These are the final products of photosynthesis in plants. They release oxygen during this process, while using light energy to convert carbon dioxide and water into glucose for their own use. This cycle supports life on Earth!",1,2.95E-09,47,1,,Oxygen (O₂) and glucose (C₆H₁₂O₆). This process releases oxygen as a waste product while using light to produce glucose for plant use. It's one of nature's most efficient ways of converting sunlight into usable energy.,1,1.07E-10,53
How many bones are in a human hand?,"The human hand consists of several bones: the wrist, palm, and fingers.

","There are 8 bones in the wrist, 5 in the palm, and 14 in the fingers.

","Adding these gives: 8 + 5 + 15 = 27 bones.
",,,27,Open Ended,,,3,"There are five bones in each hand of an adult human. Reasoning: This statement directly answers the number of bones in a human hand, providing a precise count for adults. No further information or calculation was needed.",0,2.75E-10,44,A human hand has approximately 27 bones.,1,0.6241744757,11,"27 bones in total.

Explanation: Each part (wrist, palm, finger) contributes to the overall number of bones in the hand. Adding them up gives us the correct total.",1,4.12E-09,40,3,,2,There are 27 bones in a typical adult human hand.,1,0.2195150703,14,"8 + 5 + 14 = 27 bones total. 
There are 27 bones in a human hand.",1,0.00003656621266,29,A human hand has approximately 27 bones.,1,0.6241744757,11,1,,"8 + 5 + 14 = 27 bones total. 
There are 27 bones in a human hand.",1,3.66E-05,29
